email,full_name,room_number,details
haley83@hotmail.com,Jason Johnston,J221,Lose value apply true.
robertsalfred@hotmail.com,John Tyler,J311,Summer knowledge Republican arrive hair.
kelly47@gmail.com,Jon Cole,F621,Site night speak move ball.
shawnparker@yahoo.com,Lucas Nichols,K400,Test down better.
browncameron@hotmail.com,Kyle Banks,T124,Tell customer concern.
robinsonrobert@yahoo.com,Juan Moreno,M304,Affect oil hair family lawyer pass.
smithrichard@yahoo.com,Glenda Lopez,K402,Should thus threat.
williamsalfred@hotmail.com,Antonio Martin,Y220,Instead sit writer race nation church.
psmith@yahoo.com,Susan Wilson,G116,Few win middle.
lindataylor@yahoo.com,Eddie Rose,T618,Town center red quickly heavy.
duane17@gmail.com,David Jacobs,E519,Great crime race.
shelleygomez@yahoo.com,Jessica May,W620,Different involve eight event get.
xmora@hotmail.com,Brian Rice,Z400,Visit education amount cut individual.
aaron29@yahoo.com,Willie Reynolds,R619,Hundred likely voice cup education design.
joel39@hotmail.com,Julie Perez,W325,Possible people become contain help.
matthew65@gmail.com,Rebecca Bryant,R121,Capital term north free into evening.
rodriguezmichelle@yahoo.com,Jennifer Cross,Q404,Most this director.
brownkara@gmail.com,Michael Miller,F420,Modern line provide provide we.
tpearson@gmail.com,Stephen Moore,P105,Still wish democratic bag available authority.
robert08@gmail.com,Tyrone Benson,H225,Machine spend north better close talk.
kendraandrews@yahoo.com,Brian Barber,K305,Respond physical bar range respond.
christophersparks@hotmail.com,Valerie Morris,B616,Fill a industry.
seanwolfe@yahoo.com,Ryan Snyder,E422,Road lay ball interview particularly.
hughesjason@yahoo.com,Sheila Gregory,X624,Financial kid year animal administration.
pamelaalvarez@yahoo.com,Ryan Valencia,T516,Account lose rich.
teresataylor@gmail.com,Matthew Romero,B108,Test morning spring card rather even.
kristenking@gmail.com,Michael Pierce,Y308,Business approach huge cup better describe.
donnabailey@yahoo.com,Melissa Wilson,M419,Onto through discuss security must.
hhorton@yahoo.com,Joseph Ward,Q403,Every age career interesting everyone.
richard86@gmail.com,Ryan Boyle,S214,Family claim production involve.
kluna@hotmail.com,James Figueroa,B617,Institution meet quickly physical against.
allenchristopher@hotmail.com,Sean Riley,O200,City best now trip argue.
jamespreston@hotmail.com,Benjamin Wilson,M224,Clearly away face person.
johnsonjill@hotmail.com,Joshua Simpson,H215,Scientist help cause teach itself sell.
clintonharris@gmail.com,Anthony Robinson,Y115,Total eight knowledge arm.
fcunningham@yahoo.com,Lori Proctor,Z325,Rest experience receive no small.
frederick46@yahoo.com,Cameron Kim,R512,Grow lose off.
linda92@yahoo.com,Michelle Martinez,P301,Green evening cell nor authority.
plindsey@gmail.com,Samantha Scott,L206,Move writer change.
brandon56@yahoo.com,Amy Taylor,F519,Relationship development catch.
hollandstephanie@yahoo.com,Sylvia Wong,S203,Change none gun best region.
ericmoody@hotmail.com,Mrs. Carolyn Daniels MD,A414,Need miss why property.
ariel96@gmail.com,Lisa Gomez,X508,Understand six that interesting.
christymartinez@hotmail.com,Kenneth Lewis,S107,Enter bag college fund outside.
susanespinoza@yahoo.com,Kristina Torres,C310,Little exist future.
ariel87@yahoo.com,Jorge Malone,S614,Less name floor among.
georgemoreno@gmail.com,James Gilbert,T616,Discover each she special smile week.
johnsonthomas@gmail.com,Christopher Rogers,T621,Million according probably happy possible.
stephen80@gmail.com,Marilyn Duke,U206,Employee loss plan knowledge speak.
deniseleonard@hotmail.com,Tracie Hernandez,D209,Officer pass probably receive.
yhartman@yahoo.com,Ashley Camacho,V502,Letter option sea walk.
ajordan@hotmail.com,Robert Cochran,H106,Bill cup season cause.
kellyjimmy@gmail.com,Danielle Padilla,K312,Local less institution hand lawyer career.
shirley63@hotmail.com,Lynn Schmidt,Y407,Middle as thus interest capital.
xarmstrong@yahoo.com,Melissa Morris,T210,Plan whether simple wide.
scottvang@yahoo.com,Dalton Smith,N124,Food around list.
nfrederick@gmail.com,Julie Simmons,S200,Second leave business religious.
kristinacampbell@yahoo.com,Autumn Wilson,J624,Speak statement hand.
callahanlori@gmail.com,Shawn Hines,I117,Resource tell find manager like property.
iwright@hotmail.com,Sara King,C209,Standard public dinner air imagine beautiful.
moorelindsay@gmail.com,Gabriela Martinez,T419,Care appear market.
dudleymelissa@gmail.com,Darlene Hudson,C120,Stuff war safe.
kendrafigueroa@gmail.com,Joyce Green,N109,Trip begin usually everyone.
pboone@hotmail.com,David Hogan,L415,Art attack answer design try peace.
ilittle@yahoo.com,Robert Miller,C603,Against possible performance early.
lucasjoseph@gmail.com,Joseph Nelson,L425,Which break off.
reyestina@gmail.com,Mr. Joseph Jordan Jr.,N324,Weight paper yard such.
tgarcia@gmail.com,Richard Sullivan,J603,Young near couple financial.
andrew38@yahoo.com,James Warren,H207,Morning another even economy land movie.
pottertina@hotmail.com,Dawn Sanders,I422,Activity grow fast specific.
nwalter@yahoo.com,Robert Taylor,H101,Number interest not want.
thorntonrobert@hotmail.com,Travis Scott,T218,Figure finally can me bed get.
ttran@hotmail.com,Gregory Gutierrez,M602,Cup read TV inside.
benjamin09@hotmail.com,Roy Dominguez,H213,Share deal half.
kennethcampos@yahoo.com,Derrick Weeks,U410,Remain field oil.
buckleycharles@yahoo.com,Andrea Mack,B305,Build grow main something chair.
emily88@gmail.com,Julie Bryant,T424,Seem someone several usually without show.
daniel48@yahoo.com,Amy Brock,W216,Half fast high challenge series production.
robert39@gmail.com,Paige Ramos,L620,Lawyer actually never series government evening.
terrisullivan@yahoo.com,Zachary Franco,E302,Wide total set class.
jwilson@hotmail.com,Eric Moore,D407,Those soldier right history.
christina43@gmail.com,Angel Small,R408,Role relate responsibility believe.
ksanchez@yahoo.com,Teresa Allen,R414,Another area pick low question.
danielbaker@yahoo.com,Dustin Smith,W420,Consider reach require reveal none expert.
jacksonkyle@gmail.com,Robert Pham,M316,Respond long the.
jhobbs@gmail.com,Lori Klein,B203,Best poor listen just debate local.
davistroy@yahoo.com,Sarah Martin,E424,Election about commercial order career tell.
ntrevino@gmail.com,Bridget Cantu,M609,Local management fill.
fuentesdanielle@gmail.com,Melissa Gutierrez,R125,Firm successful hair.
samantha06@hotmail.com,Stephanie Thompson,O423,Figure sound could bed arm vote.
rrios@yahoo.com,David Fry,P219,Culture walk hard.
iharper@hotmail.com,Sherry Cole,M116,Choose its apply.
costaedward@gmail.com,Jason Pacheco,X403,His protect until establish.
nichole11@hotmail.com,Peter Larson,L416,Fear pick policy say thousand create.
onelson@gmail.com,Tina Harrison,P200,Month matter second.
megan77@hotmail.com,Johnathan Nelson,S611,Fine decide husband skill economy family.
rosesamantha@hotmail.com,Lisa Barr,C321,Arm company age create.
jarvisthomas@yahoo.com,Denise Lee,S520,Happen different issue step forget.
ojackson@gmail.com,Jonathan Cobb,K623,Protect writer exactly hand nation.
icrane@hotmail.com,Mitchell Ruiz,N412,Apply want hair lead treat.
landerson@gmail.com,Paul Moore,H500,Work commercial paper fight movement information.
garnerdeborah@yahoo.com,Michele Smith,A624,Real finally able evening how.
michael49@yahoo.com,Ryan Donovan,P510,Poor officer son goal she.
daughertythomas@yahoo.com,Matthew Jimenez,C525,Lead budget either wonder continue plan.
marthashort@gmail.com,Patty Lopez,E316,Citizen name job central all pretty.
kristinadennis@hotmail.com,Charles Palmer,P112,State their near happy fall brother.
adam57@yahoo.com,James Ramos,X123,Start Democrat for growth character firm.
santosmichael@gmail.com,Scott Price,R404,Bit you again.
jennifermartin@hotmail.com,Brian Walsh,T318,And special behind only.
richardserrano@hotmail.com,Andrea Miller,P220,Decide question nearly town.
brownjohn@yahoo.com,Nicholas White,D320,Task everyone help health on believe.
nicoletaylor@gmail.com,Austin Wilson,N522,Piece visit must.
beverly01@hotmail.com,Brandon Manning,W619,Protect perform appear but fight really.
jacksonvalerie@hotmail.com,Christopher Waters,N501,Far one brother movie state total.
johnsonian@yahoo.com,Michael Martin,T517,Peace know sit.
randallmiller@yahoo.com,Ryan Russo,F300,Business drop serve truth player energy.
stanleyconway@gmail.com,Jessica Schneider,F410,Current reduce view.
andrew57@hotmail.com,Christopher Gallegos,Q412,Bar senior once expect prove.
alexandria60@gmail.com,Kristine Davies,E201,Eye gun draw.
bthomas@gmail.com,Ellen Martin,U511,Tough cup two.
hernandezkrystal@gmail.com,Scott Reid,E125,Lay production style.
frankcombs@gmail.com,Megan Tucker,J609,At we sport car.
rebeccahernandez@gmail.com,Jerome Wilkins,A303,Coach born one opportunity.
stevenskristina@yahoo.com,Christopher Bullock,F118,Charge dark feel food mother.
powellcheryl@yahoo.com,Thomas Miller,R514,Paper election ground.
shannon87@yahoo.com,Ronald Hawkins,F605,Capital body writer.
sandersanthony@hotmail.com,James Hall,C405,Stand woman civil attorney.
mcbridevictoria@hotmail.com,Laura Warren,T104,List expect later style.
nathannavarro@gmail.com,Todd Blair,N111,Suggest contain pressure lawyer billion.
hannahparker@gmail.com,Richard Cannon,P609,Vote improve since our allow nature.
charles25@hotmail.com,Hannah Young,S110,No sound along stock guess music.
pamela49@hotmail.com,Robert Allen,W316,Mr set economic pretty join.
kwilkinson@yahoo.com,Tony Stone,Z212,Change see area help here.
vasquezmichael@gmail.com,Leonard Moore,I400,Light two executive strong.
walterchristina@yahoo.com,Mary Klein,D514,Pay consumer require site all game.
ricky70@yahoo.com,Mr. Ryan Jones,W218,Close one fund myself.
