email,full_name,room_number,details
marshpaul@gmail.com,Thomas Ortiz,K524,Mean behind idea wear market.
gilbertshannon@gmail.com,Tyler Ford,V312,Ball what collection beyond machine prevent.
mcooper@hotmail.com,Erica Smith,L514,Thing outside kid decade.
dspears@hotmail.com,Laura Munoz,T120,Executive tend exactly data data.
tjones@gmail.com,Michael Weaver,G114,Lot community with require nor all.
qshaffer@yahoo.com,Matthew Hunt,X506,Season instead which smile usually.
bknight@hotmail.com,Brenda Ellis,P207,Several whole compare order interview.
annettewilliams@yahoo.com,Jeremy Fischer,N521,Final how most second where agreement star.
natalie92@gmail.com,Kim Williams,H417,Ago dinner avoid adult.
wendy99@yahoo.com,Timothy Lopez,V306,Understand talk note room.
patrickblair@hotmail.com,Lisa Thompson,P302,Improve bring figure.
mariahayes@gmail.com,Christina Brown,W125,Charge hair we.
xgardner@hotmail.com,Shawn Murillo,D114,Make finally or might rich.
thomas43@yahoo.com,Richard Dixon,F408,Author accept per.
ghunt@yahoo.com,Christopher Mason,E425,Itself six establish.
smithandres@gmail.com,Megan Lawrence,I317,Word ago feel share rest.
agross@gmail.com,Mary Clay,R124,High central again letter.
christopher00@hotmail.com,Lisa Bradford,R311,Organization per carry material there town.
angelagibson@gmail.com,John Bush,C613,Class skin that.
cruzsusan@yahoo.com,Bradley Sanchez,C119,Common single focus including.
darrensoto@yahoo.com,Jesse Payne,N517,International growth skill.
greeneluke@hotmail.com,Marvin Banks,Z424,Treat community safe both great.
kathleenlynch@yahoo.com,Wanda Guerrero,U204,Trouble perform market option they.
alicia88@hotmail.com,Alexis Mason,C125,Stand way yard care.
kevin63@hotmail.com,Tom Brooks,X108,Weight less cover ten court.
nicholas25@yahoo.com,Tracy Brown,N308,Network couple shake.
simmonsholly@gmail.com,Kevin Reyes,N403,Already many rule finish.
roberto73@yahoo.com,Nathaniel Cummings,W419,Despite race religious quickly fight easy media.
shawnrobinson@hotmail.com,Kayla Hamilton,E412,Store election since eye camera try.
cruzjasmine@yahoo.com,James Buck,G614,Respond field blue.
thompsonlisa@hotmail.com,Savannah Moore,R403,Natural north tend job direction.
vincentsanders@gmail.com,Mary Mason,P111,Career industry trip process.
kiara26@gmail.com,Paul Herman,Z414,Research the soon action history.
kathrynjones@gmail.com,James Welch,K100,Young letter call which right win.
kelly35@hotmail.com,Terry Fowler,R612,Themselves there benefit.
susanreynolds@hotmail.com,Felicia Yang,Q610,Community arrive not training which people.
cassandragilbert@hotmail.com,Gregory Maldonado,J323,Price find whom sometimes.
butlervalerie@yahoo.com,Jennifer Thomas,Q413,Western glass sound agent.
ynguyen@gmail.com,Cynthia Robertson,J408,Mr follow north art star animal.
gloria12@yahoo.com,Mary Suarez,N518,Main tonight by soldier same.
rileybrian@hotmail.com,Brittany Smith,P223,Argue worry student both various culture.
vincentreyes@yahoo.com,Janice West,G104,Majority prevent analysis tax TV.
henrymatthew@hotmail.com,Cheryl Ward,J200,Star enjoy quite.
calderonnatasha@hotmail.com,Kayla Gray,G203,Sound measure exist cover.
vrichard@yahoo.com,Robert Diaz,E105,Whatever couple enter marriage.
cindyyoung@yahoo.com,Clifford Jenkins,Y525,Mrs case wall.
tylerangel@yahoo.com,Juan Miller,G304,Both chance none market here.
christopher97@gmail.com,Christine Figueroa,O104,Space really or police that dream.
patrick84@gmail.com,Patricia Shelton,Q620,By form maybe church while.
mfarmer@hotmail.com,Timothy Ruiz,N100,Look technology describe.
margaretjacobson@hotmail.com,Donna Hernandez,W120,Gas movie control.
michael60@yahoo.com,Heather Webb,B605,Particular movie medical sort crime discussion can.
phillip35@gmail.com,Billy Ali,A104,Decision foot out name.
umatthews@hotmail.com,Jennifer Jones,K220,Score method send responsibility everything.
jessica35@gmail.com,David Griffith,V400,Make risk wrong its politics PM.
whansen@gmail.com,Charles May,G308,Suddenly talk kind general indeed series.
hessemily@yahoo.com,Christy Jenkins,R216,General leg operation police six skin.
robert09@gmail.com,Jessica Lewis,G114,Population happy statement color drive.
btodd@gmail.com,Alexander Mccarthy,X601,Work than chair.
ericmartinez@yahoo.com,Melanie Washington,X121,Name open green outside.
mfigueroa@gmail.com,Shawn Pham,P501,Process money within eat pretty.
hwilliams@yahoo.com,Benjamin Henderson,M311,Send American according budget father.
amyroberts@hotmail.com,Colin Gaines,U504,Wind maybe partner.
davisbarbara@gmail.com,Philip Burke,R200,Responsibility science election chair yet center.
gcasey@gmail.com,Lindsey Howard,X601,Keep method man cost choose after.
jeffreymorrison@hotmail.com,Tara Alvarez,Z616,Bed physical either indeed bar too.
qgeorge@yahoo.com,Lydia Howard,J301,Page many page report force.
danielhicks@hotmail.com,Maria Hall,T223,Speak clear dinner.
pmcfarland@gmail.com,Benjamin Ward,U412,Treat property wait week cover establish.
jennifercox@yahoo.com,Mario Smith,B517,Call phone every.
allentyler@yahoo.com,Kenneth Edwards,C310,Quality like everybody.
ihoffman@gmail.com,Jennifer Wright,C409,So loss environmental effect will throughout.
qwood@hotmail.com,Tiffany Stevens,L210,Process talk continue.
alexanderrichard@hotmail.com,Morgan Burns,H316,Information game appear watch.
matthewpayne@yahoo.com,Whitney Cannon,Z303,Hotel election offer resource.
alyssamassey@gmail.com,Erin Thompson,W617,Investment himself grow model notice do.
mcgeemary@yahoo.com,Jeffrey Salinas,L413,Nature skin beyond day attention follow.
cabrerabilly@yahoo.com,Cory Johnston,C206,Theory bring guy hope do hour.
zhangdeborah@gmail.com,Jennifer Duncan,E406,Stage result exactly.
griffinadam@gmail.com,Joshua Wallace,U611,Hair anything month son argue arrive.
heather79@yahoo.com,Evan Obrien,W417,Establish ever body member.
othompson@yahoo.com,Jimmy Henderson,P412,Including safe would adult hard stuff.
shannonjackson@gmail.com,Michael Martin,P425,Street third security ahead build everyone.
samuelfrost@yahoo.com,Wesley Alvarez,D625,National stage above manager into kitchen.
nathaniel69@yahoo.com,Marcus Castaneda,V402,Learn its another notice.
shannon54@gmail.com,Jose Kim,E216,Smile call small hope former painting.
peggyweaver@yahoo.com,Pamela Austin,U421,Nice whom stage possible resource.
raymondgibson@yahoo.com,Melissa Robertson,Q415,Similar throw yet enter.
melissaalvarez@yahoo.com,Elizabeth Yoder,V423,Girl level he.
njimenez@hotmail.com,Michael West,T616,Back fund easy opportunity.
johnsonanna@hotmail.com,April Knight,G623,Their you ok many determine least.
jasminewhite@gmail.com,Robert Johnson,G408,Over others its difference from.
nwood@gmail.com,Marcus Roman,F421,Baby woman model knowledge soldier perform.
egonzalez@gmail.com,Brian Larsen,D122,Pressure top feel they.
cindy33@yahoo.com,Vincent Hill,A407,Leg buy author back social site.
zescobar@gmail.com,Jon Reed,Q518,Follow rather manage organization old.
joyce32@gmail.com,Amanda Perry,S303,Tree bed high.
nataliemiller@hotmail.com,Jillian Williams PhD,F213,Clearly current country these difference.
emily05@yahoo.com,James Serrano,R301,Term ever sport.
roberto37@gmail.com,Tara Petersen,F216,Community reflect senior matter property.
wellsrichard@hotmail.com,Carla Lambert,C324,Whose machine page gas decision suffer.
gabriellecannon@yahoo.com,Joshua Myers,A119,Interest reduce reduce travel gas but.
copelandbrittany@gmail.com,Carol Hatfield,T103,Like start society bar truth.
montgomerydanielle@yahoo.com,Joshua Jackson,J618,Usually set agreement song away short.
sarahpatterson@yahoo.com,Jacob Summers,V318,Science energy fill newspaper long.
ronnie08@gmail.com,Sarah Lang,U515,Stand start meeting point PM right.
dspencer@hotmail.com,Sandra Aguirre,K224,Collection economy loss poor television.
kbyrd@yahoo.com,Mrs. Traci Byrd,I314,Modern white will.
patriciagreen@gmail.com,Rachel Davis,G407,Them town instead garden.
tjames@yahoo.com,Amber Brennan,M220,Necessary dog how type offer recent.
mpeters@yahoo.com,Nicholas Nixon,I620,Decision nor energy exactly site.
dennisrussell@yahoo.com,Jack Bell,X112,Cold hot environment child lose.
parrishjoseph@yahoo.com,Tiffany Davis,I418,Not throw people blue.
renee73@hotmail.com,Mark Mann,Z512,Just moment three system.
ghansen@hotmail.com,Richard Sanders,P515,Camera pass federal large politics.
oliviastephenson@hotmail.com,Yvette Lamb,D104,In exactly partner education.
wsanford@yahoo.com,Kimberly Bryant,R413,Bank skill address tree laugh.
tiffany04@hotmail.com,Kathy Kent,C114,Name drive when debate plan affect.
benjaminwilliams@hotmail.com,Christopher Walker,R316,Already role process nor better.
sarabarnes@gmail.com,Anthony Sanders,D515,Kind after surface.
jhamilton@gmail.com,Sean Smith,I620,Health including building much age.
apeterson@hotmail.com,Amanda Horton,D605,There seek around here bank.
coopernorman@hotmail.com,Kenneth Sutton,I416,Home large one material.
lopeztricia@gmail.com,Suzanne Walton,W410,Own couple among final affect.
elizabethpeterson@hotmail.com,Darin Anderson,H305,Rule sure letter food her.
gabrielle80@hotmail.com,Brian Elliott,N515,Allow individual I improve.
david20@yahoo.com,Kathleen Smith,N407,Little keep heart.
whale@gmail.com,James Harrison,E305,Politics hotel dog.
robertsjeff@yahoo.com,Richard Brown,V604,Statement live quality customer maybe.
amyvincent@gmail.com,Caleb Taylor,M503,Create research interest win know sister.
adamssara@hotmail.com,Larry Alvarez,K113,Step summer position like talk.
rmason@gmail.com,Shawn Wallace,C224,Blood although know five her protect.
newtonannette@yahoo.com,Alexander Ashley,R320,Clear eye message wife where.
tina63@yahoo.com,Andrew Schroeder,O313,This event experience want.
cuevasmatthew@gmail.com,Cynthia Morales,Y104,Clearly clear entire girl identify.
megandouglas@yahoo.com,Ryan Mays,B615,Age field very soldier dog against.
aaron38@yahoo.com,Michele Rice,M524,Baby director meeting very her play.
calhounamber@gmail.com,Elizabeth Sanchez,Y104,Story structure ok.
timothy33@gmail.com,Dwayne Kirk,B120,White yard office.
vincent17@hotmail.com,Laura Ward,S618,Station travel necessary radio full arm.
whernandez@gmail.com,Nicholas Mckay,Z609,Class return well.
kennethfreeman@gmail.com,Amanda Hart,B107,Executive west detail.
scott47@hotmail.com,Roy Faulkner,X202,Rule media whatever.
reidmark@gmail.com,Jeffrey Hill,D515,Thought concern start last ten late.
fandrews@hotmail.com,Jillian Wilson,Y323,Card watch figure attack gas case.
matthew88@yahoo.com,Christopher Miller,C324,Five American act.
andrew01@hotmail.com,Jason Smith,Y609,Very office help reflect.
danielhancock@hotmail.com,Thomas Wilson,D513,Very night doctor give media.
moorenathan@hotmail.com,Katherine Santiago,W323,Toward across fill picture.
edwardlewis@yahoo.com,Patricia Martin,V211,Book accept watch government.
robertfranklin@hotmail.com,Jean Allen,G516,Last nearly push half color.
elizabethreeves@yahoo.com,Stephen Tapia,Y400,Tv ball play.
iconley@hotmail.com,Leslie Butler,K421,Home day question board.
fishercharles@hotmail.com,Sean Brown,M505,Process chance never cup.
suzanne27@hotmail.com,Tracy Stafford,Y113,Standard consider response tax.
joseph85@gmail.com,Robert White,T612,Deep instead week face simple.
michelejones@gmail.com,Daniel Johnson,D112,Position resource may firm side.
osmith@gmail.com,Kimberly Moore,Y119,Research guess art.
qsimon@hotmail.com,Jennifer Bass,N518,Language recognize staff west already tonight.
sheila20@gmail.com,Mary Lane,C211,Fear class yeah chair professor improve.
franciserin@yahoo.com,Laura Thompson,M113,Cover security could popular determine.
ivanmendoza@gmail.com,Melissa Garza,E122,Pm evening instead impact.
phowell@yahoo.com,Lori Murphy,A206,Score phone same service always.
wrighthannah@hotmail.com,Christopher Thomas,S413,Food best education recent fund.
adrienneblake@hotmail.com,Jay Jones,R123,Could group energy speech.
nicoleduncan@yahoo.com,Gilbert Wilson,J113,Success least religious keep improve.
cgillespie@hotmail.com,Joshua Moore,K517,Sound fund well wife identify.
floydjason@gmail.com,Felicia Price,J402,Enjoy imagine catch.
carrollsteve@yahoo.com,Daniel Medina,Q101,With relate indicate.
hilleric@gmail.com,Tony Mcknight,N404,Very important cut relationship.
michael95@yahoo.com,Megan Brown,J617,Floor recent real.
wthompson@gmail.com,Stephanie Webb,D110,New his time recognize system.
patrick97@gmail.com,Sara Henry,L401,President produce become.
vtaylor@gmail.com,Matthew Espinoza,K514,Heart above newspaper leg wonder you.
julia47@gmail.com,Kathryn Jenkins,M325,North in join pretty.
ryan58@gmail.com,William Walker,M509,Around few situation region step.
sarahansen@yahoo.com,Jason Harris,B605,Per hand morning represent campaign.
krichardson@gmail.com,Leah Thomas,H119,Something produce area join.
wendy49@gmail.com,Daniel Hurley,L418,Recognize which admit about treat pay.
michaelsmith@hotmail.com,Michele Sanchez,P507,Support person scene.
robertmorales@gmail.com,Juan Hill,C515,World series gun away act.
davidpetty@gmail.com,Jillian Johnson,J118,Listen goal already official.
sean74@gmail.com,Kevin Schroeder MD,C308,Force somebody across them.
caitlinmartinez@gmail.com,Vanessa Smith,P622,Only you conference cell operation.
dhoward@hotmail.com,Donald Knight,J313,Effect final ground become now.
katherine71@gmail.com,Charles Davis,V309,Wonder someone street.
codykramer@hotmail.com,Kristy Bradley,C213,Store even high believe.
peckkelly@hotmail.com,Heather Weaver,O120,Defense north eat.
kimberlyhawkins@yahoo.com,Terry White,E224,Story also which.
hayden35@hotmail.com,Michael Brock,O103,Scientist manager nature.
schroederamanda@hotmail.com,Kelly Owens MD,L624,Fast sometimes recent later son project.
unelson@gmail.com,Marie Lee,G508,Culture hit agreement after rate receive way.
hjimenez@hotmail.com,Brian Oliver,G413,Could situation degree people.
zimmermanlarry@yahoo.com,Kayla Fleming,S622,Forget end sense reduce.
andrew62@hotmail.com,Alicia Reyes,X214,Behavior star less important second.
kelly46@hotmail.com,Charles Perez,C615,Recognize report material pattern trip.
ndelacruz@gmail.com,Bill Johnson,H222,May for stay safe yourself history.
vcampos@yahoo.com,Michael Contreras,B623,Open rest loss central.
stantonrhonda@yahoo.com,Robert Harris,C316,Series visit enough.
perrychad@yahoo.com,Rhonda Rivera,I419,Try gun rock boy.
ralph65@gmail.com,Brad Rodriguez,A320,Care another environment ago.
stevenwright@hotmail.com,Jeremy Butler,N419,Player international but.
bennettcraig@gmail.com,Russell Anderson,T216,Between save house.
nsnow@hotmail.com,Carol Davis,A222,Finish here democratic why.
xbarnett@yahoo.com,Michael Larson,M603,Control anyone pull.
ecruz@hotmail.com,Kayla Thomas,A413,Morning pretty hair control.
batesdrew@yahoo.com,Marissa Wilson,A322,Trip think audience.
heathernichols@gmail.com,Michele Dickson,B519,Early during fish.
diana09@gmail.com,Amber Garcia,H306,Themselves network from full rest.
hward@hotmail.com,Tracey Warner,N502,Gun sister point seven.
scottmiguel@gmail.com,Kristin Castro,J522,Clear price onto.
rrice@hotmail.com,Troy Smith,F500,Firm worker nearly score issue.
qfowler@gmail.com,Ronald Sullivan,D109,Return each another perhaps total society.
beankurt@yahoo.com,Carrie Warren,M500,Yard low last.
larsonapril@hotmail.com,Cynthia Ruiz,I321,Term leave Mrs else.
benjaminwilson@hotmail.com,Gloria Graham,R202,Crime film could long south as.
lewiskatherine@gmail.com,Gabriel Owens,U509,Least among citizen.
sean96@hotmail.com,Michelle Harper,E423,Itself nor development.
robertmiles@gmail.com,Catherine Castillo,D517,Sit society stand go relationship.
mbriggs@gmail.com,Michelle Moss,B423,Good marriage until local beautiful.
hudsonkarl@hotmail.com,Alicia Young,T117,A Congress college evening college.
zolsen@hotmail.com,Lindsay Boyd,T302,Piece soon should.
lacey14@gmail.com,Claire Montgomery,G206,Seem travel necessary.
janetwagner@gmail.com,Richard Thompson,I308,Total challenge else soon.
johnjohnson@gmail.com,Luke Chang,H213,Authority woman million dog sing.
datkinson@gmail.com,Megan Hayes,E424,Begin box message majority south level.
emorgan@hotmail.com,Karen Bryant,D505,Left foreign special.
lanecharles@yahoo.com,Daniel Wilson,U525,Offer join material.
tfisher@gmail.com,Michael Potter,L602,Ago short who low language.
clementsnancy@yahoo.com,Richard Santiago,L513,Table blue use.
reyesrenee@gmail.com,Robert Boyd,J514,Alone citizen himself success teach.
vmeyer@yahoo.com,Kelly Martin,A411,State per moment.
hscott@yahoo.com,Angela Ruiz,N500,Five key such hold.
klinemichael@gmail.com,Dr. Kyle Baker,U316,Character skin receive.
travis85@gmail.com,Kimberly Bowers MD,E506,Different choose their.
kellycurry@gmail.com,Timothy Barber,B223,Defense among single per agency.
obryant@gmail.com,James Dickson,C307,Lead situation cut Mrs story test.
ujimenez@yahoo.com,Peter Allen,F218,Few toward medical.
kristophercharles@yahoo.com,David Ward,M203,Mean daughter sit institution.
johnporter@yahoo.com,Amanda Johnson,A400,Security speak attorney after next.
michaelmorgan@yahoo.com,Carolyn Phillips,H501,Fast mention while.
tammydixon@hotmail.com,Scott Lowe,A106,Blood policy single attorney.
xdelgado@yahoo.com,Faith Harris,S113,Ago special attack.
nelsonedwin@yahoo.com,David Hanson,R103,Which minute everything.
martinalexander@yahoo.com,Susan Bowen,J221,Know evening third health social.
parksdavid@hotmail.com,Justin Kelly,S301,Send upon experience.
hardybryan@hotmail.com,Michelle Terrell,N612,End style not treat could.
derrick02@gmail.com,Travis King,N223,Speak child great benefit story.
tonyaprice@gmail.com,Richard Freeman,K209,Wonder mention his forward technology hand.
castropatricia@hotmail.com,Michelle Brandt,X118,Blue place region read anything Democrat.
kmedina@yahoo.com,Oscar Wagner,W600,Glass town left remain big.
riversmatthew@gmail.com,Stephanie Underwood,X302,Focus lawyer sort against base nice.
mason99@hotmail.com,David Best,T205,During add majority decide note can.
stewartwendy@hotmail.com,James James,W121,Support grow allow deep.
cisnerosvictoria@yahoo.com,Eugene Erickson,D207,Without defense dog push.
wesley35@hotmail.com,Brett Gregory,O320,Yeah degree center.
moorecynthia@hotmail.com,Ryan Graham,H304,Effect lay cover east office.
pturner@yahoo.com,Cheryl Christensen,C506,Always factor money.
andreaoneill@hotmail.com,Stacy Richmond,S425,Cost relate walk management expert able.
vhernandez@yahoo.com,Adam Montgomery,R219,Late buy research.
ghoward@yahoo.com,Dylan Flores,F203,Specific could through structure respond score.
zstephenson@gmail.com,Barry Hammond,B611,Price behavior sit research section training.
egomez@yahoo.com,Luis Blackwell,Q405,Sister travel mouth.
tyler57@yahoo.com,Kayla Freeman,Z409,Mouth wonder red plan.
peterobrien@hotmail.com,Patricia Walsh,S110,Out drug structure few.
kwells@gmail.com,Vanessa Gray,H413,Option write different method recognize face.
kmeyer@gmail.com,Judy Vasquez,K213,Use must meeting with.
tony96@gmail.com,Meghan Ray,M213,Should hard common body order Congress.
whorn@yahoo.com,Christopher Moore,E513,Phone get dinner machine.
antonio60@gmail.com,Lorraine Perry,V615,Quality establish message recent card.
selena17@hotmail.com,Jeffrey Robinson,G322,Whose design likely analysis plan.
pross@gmail.com,Melissa Washington MD,R511,Scientist senior program where.
jill39@gmail.com,Casey Barker,T613,Economy still throw simply.
williamsmeghan@gmail.com,Paul Harmon,V623,Bad series free.
stephanie43@yahoo.com,Tiffany Ryan,Q506,Dog evening care support not.
cindy86@gmail.com,Joshua Guerrero,U307,Reason student determine.
wcollins@gmail.com,Tammy Cruz,Z122,Subject say group whole old majority.
munozrussell@hotmail.com,Mr. Christopher Curry,N104,Life so write use each.
josephwalker@yahoo.com,Jason Duran,B220,Which long never public hair positive.
michaelfinley@gmail.com,Stephanie Young,M618,Stage learn job lot which agent.
robertroman@yahoo.com,Jennifer Schwartz,Z512,Appear long challenge.
mitchellcampbell@yahoo.com,Justin Kennedy,N404,Chance where rock education seem even.
webbtracey@yahoo.com,Lindsey Jackson,O120,Notice about cell.
paynenicole@hotmail.com,Brian Beard,Y609,Land keep wife century time see.
pmiller@yahoo.com,Jason Le,A419,Reveal show morning in no.
mackenzie50@yahoo.com,Luis Walter,W401,May price character body leave reach.
weberandrew@gmail.com,Katelyn Ross,F504,Dream know guy over hundred southern.
andrea84@yahoo.com,John Burns,T209,Everything child onto send.
aaronberry@yahoo.com,Heather French,F518,Skill could measure activity.
stephen88@yahoo.com,Julie Garcia,L507,Occur southern number successful reality TV.
robertrogers@hotmail.com,Christine Roberson,Y304,Government poor her opportunity good treat.
santoscharlene@hotmail.com,Darren Reese,S225,Brother morning former yard.
hectormcdonald@yahoo.com,Thomas Davis,S300,Bag close rather.
mnguyen@yahoo.com,Kevin Rollins,I110,Former realize interesting song ok.
sarahmartin@hotmail.com,Jeff Leon,S305,Low read down political nor cup.
kathybrown@yahoo.com,Roger Woodward,L522,Pattern yeah indicate control.
lance85@yahoo.com,Adam Miller,Y222,Strategy sell pass bed mission heart.
kleinwilliam@hotmail.com,Rachel Mills,G210,Training case itself pay offer.
kwatson@gmail.com,Sheila Ibarra,M112,Hospital cut conference of sell.
jamieshannon@yahoo.com,Mrs. Michelle Mclaughlin,P600,Instead develop protect peace animal south.
jessica58@hotmail.com,Tina Cameron,U622,Yet officer mouth.
wjenkins@hotmail.com,Ashley Gray,P505,Grow eight something.
rdiaz@yahoo.com,Tara Sheppard,U509,Age television language appear break indicate.
qperez@gmail.com,Alexander Trevino,I111,Sign compare far money.
stricklandmichael@gmail.com,Kayla Kirk,F222,Animal successful down.
thomasrichardson@yahoo.com,Jennifer Mays,E522,Police home bill stage cause.
maddenmichael@yahoo.com,Samantha Hamilton,U625,Question consumer blue right everybody.
davidflowers@yahoo.com,Ronnie Patrick,Z625,Station finish personal.
ccarter@gmail.com,Stacy Murray,Q522,Sister prove trial.
sean46@hotmail.com,Eric Contreras,T516,Difference idea particular approach.
hillmary@gmail.com,Christopher Miller,N604,Could play ago area gas.
rebeccabarker@gmail.com,Jonathan Roberts,D404,Present rise debate language.
oliviajones@gmail.com,Erika Tanner,V421,Worry positive rule degree along.
jaclynwatts@yahoo.com,Brenda Powell,M223,Message worry possible.
tommitchell@yahoo.com,Elizabeth Hunter,E625,Suggest doctor adult call us.
andersonashley@yahoo.com,Mrs. Gloria Sanders,J619,Partner none author pass.
camachochristine@hotmail.com,Jennifer Norman,L419,Fly at or almost old such.
veronicamcdaniel@gmail.com,Shannon Robinson,K219,Lay color whole feel middle direction.
greggarrett@gmail.com,James Martin,E211,Local manager recognize.
jefferycameron@hotmail.com,Jamie Matthews,P513,Among Mr agreement.
mariaolson@hotmail.com,Joshua Juarez,C411,Hope society Mrs.
leedavid@hotmail.com,Karen Byrd,X309,Early imagine against teach the law.
abigail74@yahoo.com,Charles West,Y316,Popular interview hospital table real charge.
eric82@hotmail.com,Dr. Patricia Miller,E305,Space form low.
icraig@gmail.com,Crystal Heath,I218,Despite may popular.
melissafarmer@yahoo.com,Gina Burnett,U602,With enjoy my police.
brooksjudy@hotmail.com,Beth Bailey,G319,Guy eye Congress information teach someone.
hornhannah@gmail.com,Michael Esparza,U106,Letter skill among as.
nixonmason@yahoo.com,Janet Marquez,V109,Whole despite establish experience how.
jessicaarnold@yahoo.com,Patrick Cooley,B507,Deep different next majority international several.
brooke18@gmail.com,Jonathan Nicholson,U503,Key them from human decision customer.
caitlyn85@hotmail.com,John Sanchez,K614,Talk me scene smile trouble shake.
fisherwilliam@yahoo.com,David Jones,R401,Break surface page garden speak this center.
ohodges@yahoo.com,Melanie Kirk,V325,Hundred cover down foreign bed defense.
tgreen@yahoo.com,Stephen Allen,N120,Role turn finish plan.
portererin@yahoo.com,Tonya Thomas,A103,Tend including college special.
hlewis@yahoo.com,Nicole Flores,A209,Staff high herself care vote these.
amyhanson@gmail.com,Leslie Sampson,T515,Mouth draw degree church.
bholmes@hotmail.com,Gregory Thompson,R301,Interesting themselves surface me happen begin.
harrisdavid@hotmail.com,Matthew Sanchez,Q201,Image edge director wide.
amandaschwartz@gmail.com,Sarah Hardy,H303,Former manage cover ten eye.
masonmccann@yahoo.com,Sonia Delgado,Q322,Argue entire site tell pay together.
andrewharris@hotmail.com,Aaron Reed,P413,Of someone toward room.
omason@gmail.com,Karen Walker,E207,Hit work ever natural.
hartdavid@gmail.com,Barbara Hughes DDS,D524,Job ago fear name.
davidnorris@yahoo.com,Tina White,N315,Off million address eight read word whatever.
nicolelindsey@gmail.com,Mary Mcguire,W104,Behavior else available before side.
lmoore@yahoo.com,Daniel Evans,V211,Worker reality ahead allow population human.
dunnmarissa@yahoo.com,Michelle Phelps,U404,Practice son bring.
briannakennedy@yahoo.com,Michael Walker,M209,Action month lot what.
devonmartinez@yahoo.com,Nina Fletcher,K204,Much admit when form help if.
patricia38@hotmail.com,Evan Collins,M109,Simple describe amount within impact animal.
jbradley@gmail.com,Kyle Flores,Q607,Himself task information dark.
bellsharon@gmail.com,Amanda Collins,W221,Our good ground whole she.
asimon@yahoo.com,Elizabeth Walker,N402,Type certain himself low.
christophermendez@hotmail.com,Jeffrey Hardy,G201,Produce serious fill keep radio camera.
christine72@hotmail.com,Christopher Baker,O204,Us government prove attorney late.
maria28@yahoo.com,Eric Hoffman,F300,Own itself relate spend.
dsmith@gmail.com,Sarah Roach,Q222,Region degree record however any give.
jay22@yahoo.com,Andrea Mooney,T303,Argue win back structure.
raymondbrown@gmail.com,Brittany Cox,V314,Quickly week range population theory.
lucasbishop@hotmail.com,Carolyn Pierce,A102,Together sell meeting want.
jenniferjohnson@yahoo.com,Kenneth Welch,U613,Down television feel author identify.
edalton@gmail.com,Christopher Gomez,E302,Week statement within.
