created_at,help_type,priority,status,details,email,full_name,role,subteam
1764484604836,urgent,medium,failure,Heavy way class PM coach region expert card company order in center all three media suddenly past realize.,myoung@gmail.com,Kyle Ramsey,staff,logistics
1764484604836,other,low,resolved,Surface wife father ready ahead free prepare hard successful past listen know to close computer their action back indicate fly according beat life cut issue dream so early couple agreement wide.,ooliver@hotmail.com,Maria Beard,staff,registration
1764484604836,urgent,low,resolved,Tax time must artist century then full order recently size network walk safe various someone particular follow respond early indicate blood dream up activity might safe popular finish field somebody international short.,rduke@gmail.com,Kristina Knight,staff,security
1764484604836,urgent,low,pending,Hope Congress born least person guy sure mean mission central sister manage tend baby through company ask home project girl read until pretty church money enough particular stuff early.,ywhite@gmail.com,Brandon Barrett,attendee,
1764484604836,other,low,pending,Day avoid despite since ever page account ever important manager individual side short religious father military wrong well none chance rock still behind rather different defense main small decade wonder physical trip right.,egarza@yahoo.com,Frank Jackson II,attendee,
1764484604836,urgent,high,resolved,Stay see raise marriage law their eat television travel news hand than street hotel instead beat my how pick American collection cell interview call improve box according return.,lisa15@gmail.com,Samuel Morris,attendee,
1764484604836,urgent,low,pending,Smile side national outside single military that resource black key reason kid mission point live second wall here time serve anything likely vote successful although onto response news car leg scene not race.,andrew94@gmail.com,Ann Castillo,admin,
1764484604836,question,high,failure,Catch voice significant thus threat piece between face fund sometimes relationship spring risk dog when southern professional evening their go assume town should us responsibility dark Democrat above agent you effect message painting note.,jeanette25@hotmail.com,Dr. Sarah Sims,staff,logistics
1764484604836,question,low,failure,Mission huge along fear unit herself you would professor knowledge enough significant general as tonight leader fact tell he center after right number current still.,linda84@hotmail.com,Ashlee Hooper,staff,technology
1764484604836,urgent,low,failure,How station leave brother similar seem president such these almost culture create feeling back activity main mission cultural yes community understand provide politics man network per baby final subject.,hannahhampton@hotmail.com,Amy Hooper,admin,
1764484604836,urgent,low,resolved,Husband note rest watch including term choose fund sign collection identify any to image true nice must themselves necessary subject natural let across population heart.,jamiewhite@gmail.com,Brian Jensen,staff,operations
1764484604836,urgent,medium,pending,Development beautiful arm analysis else just knowledge power news race section quickly two pull dog class man follow not car big under lot free leave you along fine ready ball order ago teacher.,christopher45@hotmail.com,Nicholas Nguyen,attendee,
1764484604836,urgent,low,pending,Nor south control game affect including let hour business public still data seven society occur set part property feel.,albertdixon@yahoo.com,April Ross,attendee,
1764484604836,question,medium,pending,Method general about health cost today marriage hospital bed effort statement board special culture agent decision key response few if boy help.,melissa00@hotmail.com,Jane Reyes,attendee,
1764484604836,question,low,resolved,Budget painting same address coach threat form space large take director listen treat central listen.,craigwright@gmail.com,Karen Miller,attendee,
1764484604836,urgent,medium,failure,Method product never go hand fund put movie response its dream nothing religious us have according water stage animal or positive last.,fwashington@gmail.com,Heidi Rowland,attendee,
1764484604836,question,high,failure,Significant way issue west activity show peace director produce open information spend bad remember happen feeling plant explain total son official ago though investment dog blue return current rest direction.,kellygreen@hotmail.com,Daniel Moore,attendee,
1764484604836,question,medium,pending,Interest also face law make grow above remember offer so day accept wind range never box represent her possible foot expect.,vlarson@gmail.com,Eddie Burton,admin,
1764484604836,urgent,medium,failure,Learn group attention in fall put middle wide teach value another war several arm campaign.,jacksonmichael@hotmail.com,Dawn Andrade,attendee,
1764484604836,urgent,high,failure,Actually center recognize despite those serve positive public beat trouble part behavior relate draw buy.,edoyle@yahoo.com,Cheryl Rodriguez,staff,security
1764484604836,question,medium,resolved,Democratic any exactly child environmental training room special modern economy miss since whatever second picture trouble act grow child nearly structure reduce week.,stephenprice@hotmail.com,Jonathan Lucas,attendee,
1764484604836,question,medium,pending,Require actually everything one color material break develop know station century north level design rather those strategy couple drop level almost walk.,william99@gmail.com,Cynthia Barnes,staff,logistics
1764484604836,other,high,resolved,Single imagine line writer sea boy test whole sister tree public skin agency now across charge herself single difficult trip lose red assume.,munozthomas@hotmail.com,Eric Jackson,attendee,
1764484604836,other,medium,pending,Product discussion today late participant suddenly let employee close ago sometimes relationship become only particular.,nwhite@yahoo.com,Audrey Rodriguez,attendee,
1764484604836,urgent,low,resolved,Community scientist product break sell any already test she entire entire so throw building evidence range notice city describe so house movement indicate though than together might responsibility western.,hortonanna@yahoo.com,Melinda Lawrence,attendee,
1764484604836,other,low,failure,Expect important across company one however Mrs before score positive week already forward modern feel partner read performance answer whether alone realize force body live although.,padillascott@hotmail.com,Kathleen Brock,attendee,
1764484604836,question,low,resolved,Stage treatment he gas hit address carry car green need head western enough miss book fine call detail American son own I loss.,edwardallison@yahoo.com,Justin Cole,attendee,
1764484604836,urgent,low,failure,Various course probably job hair fall for without as land western fall business address similar plant clear reflect so someone night adult at.,smithashlee@gmail.com,Elizabeth Brown,attendee,
1764484604836,urgent,high,resolved,Art sign take contain grow research business avoid main responsibility source because nice final poor through run know writer that month fight occur consider.,laura02@hotmail.com,Mark Young,staff,security
1764484604836,other,high,pending,Different Mr important pretty trade this democratic machine indicate bit be military agency already need level over save board prepare Democrat factor job available coach wait see.,hawkinsheather@hotmail.com,Thomas Peterson,staff,logistics
1764484604836,question,high,resolved,Road final determine full soon look here seem name smile model agency hand free modern.,tuckerjoseph@gmail.com,Susan Brown,staff,operations
1764484604836,urgent,medium,resolved,Each world standard design agree prevent either risk suffer worker conference into party dinner design human citizen system protect industry direction threat late wear difference send beat show reflect each task energy.,paige84@hotmail.com,Barbara Montoya,attendee,
1764484604836,other,low,resolved,Air field trial party anyone every act course wall game thank never finish environmental between.,cynthiagarcia@gmail.com,Johnny Odonnell,attendee,
1764484604836,other,medium,resolved,Imagine election knowledge woman stay scientist else a manage quite know less gas Congress individual friend front follow small about soon stop over.,janice47@yahoo.com,Sherri Smith,staff,security
1764484604836,other,low,failure,Training evening always moment themselves call expert environmental nature spring write growth trial rule hope security finally recognize carry point tough important less public usually long prove sister real mother.,kimberlyleach@yahoo.com,Christopher Goodwin,staff,technology
1764484604836,question,medium,pending,Return feeling tree address early value late bill personal low item behavior international else how type for religious likely million particular include.,smithrebecca@gmail.com,Karen Haynes,attendee,
1764484604836,question,medium,resolved,Every music however them red safe adult figure choose evidence physical cold important fire Mr add fish process meet against.,bartonmarilyn@gmail.com,Sarah Ward,attendee,
1764484604836,other,low,failure,Allow manage ten sense however measure seven campaign daughter certainly require religious set nation up nor attention even fall election among none training.,rogersrandy@yahoo.com,Deborah Nguyen DVM,staff,logistics
1764484604836,other,low,resolved,Color attorney particular worry admit here letter ask argue shake situation sort least herself second total community interview.,tammycohen@gmail.com,Katherine Vance,attendee,
1764484604836,question,high,resolved,Bank machine couple citizen official race bill argue protect trouble cover ever must question soon mouth leader Democrat level five three blue explain lay.,ooliver@hotmail.com,Maria Beard,staff,registration
1764484604836,question,medium,resolved,Skill figure management avoid billion must chance behavior over put stay author play political impact.,thomasteresa@yahoo.com,Megan West,staff,operations
1764484604836,other,high,resolved,Whatever us ten seem goal attorney professional wonder near agreement fact result member company health way character break southern simply car economic country carry effort she pull space loss little sure research response join.,randolphryan@gmail.com,Christine Kennedy,attendee,
1764484604836,question,high,resolved,Method ok manage good open box high economic lot may language along chair operation example ground picture charge drive clearly reach drop probably three perform us create like down.,pricesamuel@yahoo.com,Cynthia Garcia,attendee,
1764484604836,urgent,high,failure,Next table poor open technology modern win training member debate manager cold threat magazine blood them certain two popular parent try.,sharon38@hotmail.com,Kimberly Jones,staff,logistics
1764484604836,urgent,medium,failure,In subject religious ball various those age remember spend always me argue everything guy stuff beautiful top whether way approach just join she.,wayne94@hotmail.com,Daniel Montgomery,staff,registration
1764484604836,urgent,low,pending,Vote quality usually range service player recent film sister music material into safe tax member wrong she.,ulang@yahoo.com,Robert Wilson,attendee,
1764484604836,urgent,low,resolved,Trouble series key collection call truth order clearly their democratic plan central window story indicate could rule interest administration onto film direction down.,hortonanna@yahoo.com,Melinda Lawrence,attendee,
1764484604836,urgent,high,failure,Appear each seek movement keep car all allow dream end hand million often job doctor by seem year only market recent student choice everybody thank.,christophersalas@gmail.com,Jennifer James,attendee,
1764484604836,question,high,pending,Though bar traditional seven assume main national economic scene recognize step have consider store impact much middle teacher benefit season discover factor.,annahurley@yahoo.com,Anthony Jacobson,attendee,
1764484604836,question,low,pending,Claim current blood particular five authority believe dinner natural special while do seat threat stuff reduce might necessary still old use speech six traditional medical conference relationship employee individual forget onto bring finally property walk.,tuckerjoseph@gmail.com,Susan Brown,staff,operations
