created_at,help_type,priority,status,details,email,full_name,role,subteam
1764484731180,question,medium,failure,International there coach peace collection form before buy reveal industry similar executive image president food into grow news rate born reflect ahead.,jameswest@gmail.com,Andrew Malone,attendee,
1764484731180,question,low,failure,Often serve try about hit model suffer under perhaps amount entire these outside maintain professor success including their method song simply few score month away college certainly simply spend party only audience worker then.,brianablack@hotmail.com,Cynthia Mayer,attendee,
1764484731180,question,medium,pending,Wear city attack low citizen whom maybe upon hair heavy during science summer free suddenly quite recent soldier available indeed car Mr business maybe key fact religious stay sure goal.,piercecarol@yahoo.com,Jordan Mcintyre,attendee,
1764484731180,question,medium,resolved,Music main after seem camera through order us leave agency seat put compare sister environment society serious.,wilsonjaclyn@yahoo.com,Lisa Dean,staff,finance
1764484731180,urgent,low,resolved,Gas realize continue head manage street class walk everyone character majority civil at month treat popular write table understand various within defense enough care career than.,vlawrence@yahoo.com,Lindsey Hernandez,attendee,
1764484731180,question,low,resolved,Be security money seem life song realize clear country stay risk account difference international while imagine seek but less after thank away night necessary past wide identify scientist leader attention few.,andreawolfe@gmail.com,Emily Hill,attendee,
1764484731180,question,high,pending,Traditional heart upon easy next else heavy exist same total perform herself page three new option let indeed car example agreement standard sure near stage service name general gun everything by past.,brookslisa@gmail.com,Cameron Anderson,attendee,
1764484731180,other,medium,failure,Maintain mention road wait accept debate red food respond care finish Democrat under land compare perhaps century feel wife myself amount must keep space your well top despite sell loss.,udillon@yahoo.com,Mrs. Mikayla Martinez,attendee,
1764484731180,other,medium,failure,Town type structure finally need send above price the somebody hear third economy difficult season idea allow easy stop moment deep amount join detail consider glass material natural care baby toward into.,jrogers@hotmail.com,Tina Jenkins,staff,security
1764484731180,question,high,resolved,Above off people help campaign prevent executive put population per us might party course affect find method itself understand nation relationship buy outside sound wish oil deep cup eat democratic condition medical summer.,twhite@gmail.com,Carl Walton,staff,operations
1764484731180,question,low,resolved,Education doctor day black author available interest choice enough probably eat home report hundred night mission dog.,edwardjennings@hotmail.com,Laura Williams,attendee,
1764484731180,other,low,failure,Traditional friend popular since my rule military fear best unit six already line recognize action rather land to travel first plant difficult case far here much issue source list.,thowe@yahoo.com,Elizabeth Daniel,attendee,
1764484731180,question,high,pending,Fight leave easy fall sign price order mouth staff without attention personal Congress get power leave so girl back new example part enjoy either.,timothypennington@yahoo.com,Albert Miller,staff,logistics
1764484731180,urgent,low,failure,Dog these system join under factor space effort purpose child him inside movement respond service practice here space benefit be opportunity role.,james71@gmail.com,Justin West,attendee,
1764484731180,urgent,low,failure,Especially city four agency record agreement forget present ever pattern along environmental finally base off one instead left partner very who range crime whose whatever most.,owilliams@yahoo.com,Michael Williams,attendee,
1764484731180,other,high,failure,Us point together financial challenge draw word minute doctor still Republican serve visit idea eight help leg yourself reach western onto tell though expect ask perhaps cut effect finish describe arm alone federal between.,perezdawn@yahoo.com,Cindy Becker,staff,operations
1764484731180,other,high,pending,Term them always contain without lead entire care east camera beat product truth open seek here represent child where room study everybody seek Democrat protect film walk.,jason12@yahoo.com,Christopher Gregory,attendee,
1764484731180,other,high,resolved,Oil gas this none kitchen kitchen often care Mr realize civil view decision care argue activity large require with strategy none ahead crime long like important three fear reality them little measure.,smithbrandy@yahoo.com,Martin King,attendee,
1764484731180,urgent,medium,resolved,Goal feel also citizen challenge notice begin cut three federal former buy lose southern event debate.,ramosjoshua@yahoo.com,Heather Smith,attendee,
1764484731180,question,high,pending,Expect student defense create most forget such PM walk event its blood old none this rate rule herself better personal argue fly authority these.,josephjones@yahoo.com,Amanda Gomez,attendee,
1764484731180,question,high,resolved,Something experience at black such condition than up evening city free hear go Congress glass visit my whatever teach we involve Democrat do whose thus couple you.,davisjasmine@yahoo.com,Russell Lyons,admin,
1764484731180,question,medium,pending,Move kitchen action boy design reduce kitchen interview risk financial dinner chance up special more kitchen stop physical happen away dream like upon.,cynthia71@gmail.com,Taylor Mosley,attendee,
1764484731180,question,low,resolved,Product race a push thus sort coach structure than full throughout its too better fish as worry central.,marialopez@yahoo.com,Morgan Lewis,attendee,
1764484731180,other,high,pending,Environment parent budget cultural must development your buy anyone not at no language major media experience phone strategy rather very food first summer year leader Mrs build leader necessary enter point.,liashley@gmail.com,Richard Torres,attendee,
1764484731180,other,low,failure,Relationship change old article type house service party speak statement daughter trouble threat them result picture special sit color project room kid responsibility police institution into resource within wide east player water.,albert61@hotmail.com,Alexander Cooper,admin,
1764484731180,other,medium,pending,Hold term easy surface short city green difficult option share author radio organization such book walk smile west water quickly that design poor finally consumer prevent pass situation build public democratic accept.,gregory03@hotmail.com,Eric Christian,attendee,
1764484731180,urgent,high,resolved,Threat accept happy find house develop church with watch deal guy drive finally culture particular image.,morserodney@gmail.com,Brent Dixon,attendee,
1764484731180,question,medium,resolved,Quality bring PM poor political natural whole politics exist traditional wear have list including artist city Mr interest hour ability worry through crime activity.,delacruzkristen@gmail.com,Christopher Huff,staff,security
1764484731180,urgent,medium,failure,Too traditional number score pretty bed himself power skill pick performance hand current know kitchen happen build practice down into section finish particularly teacher fire according those particular another.,suzanne41@yahoo.com,Steven Bean,attendee,
1764484731180,other,medium,failure,Strategy whom very name impact office job physical close accept which try sing still music interest message cover gun project four strong network be peace office hot claim piece force understand.,xgonzalez@gmail.com,William Hanson,attendee,
1764484731180,other,low,pending,Model line impact event treat country enter relate discover send least social difficult law experience able instead girl walk born everything agency like indeed kitchen vote.,jodi24@hotmail.com,Sarah Mills,attendee,
1764484731180,question,low,resolved,Play region state political early shoulder one not professional different today old when foot other plan why their.,edwardrodgers@hotmail.com,Rebecca Tyler,attendee,
1764484731180,other,medium,failure,Activity bad seven beautiful most area yourself time success ever red image article drop number company goal teach order run almost.,robert34@gmail.com,Xavier Ayers,attendee,
1764484731180,other,high,resolved,Almost front school trip start fire note professor world ok catch industry responsibility health run modern seat rock.,djohnson@gmail.com,Dr. Kristen Martinez,attendee,
1764484731180,other,medium,resolved,Player Congress south future vote glass none attack know represent discussion Mr election prevent give participant person create wonder matter show main energy development couple I around whom garden specific I cut and option.,ycobb@hotmail.com,Erica Dawson,admin,
1764484731181,other,high,failure,Professional size former responsibility hair sell even subject type action church tonight draw summer lead cover.,njenkins@hotmail.com,Caroline Munoz,staff,registration
1764484731181,urgent,medium,resolved,Think he already individual deep must only national exist foot billion sing chance size once task long our.,thomas67@gmail.com,Tracy Martin,attendee,
1764484731181,urgent,medium,resolved,Certainly firm daughter church PM pay answer between table deep magazine big between sing sense.,kimrobert@yahoo.com,Alexander Peterson,attendee,
1764484731181,question,high,resolved,Parent story contain to computer image return including church interesting your seat physical receive less left team enter face agree same east center conference various every usually crime at.,owilliams@yahoo.com,Michael Williams,attendee,
1764484731181,question,low,pending,Record stock development too clearly rate pass history true sure seek example his machine available perhaps police TV particular.,jonathonpeters@gmail.com,Andrew Cook,attendee,
1764484731181,other,high,resolved,Contain government measure action cup serve often once girl government season actually ask court bad step deal paper could quality her animal feeling within could table store.,reyeskimberly@yahoo.com,Shane Tran,attendee,
1764484731181,urgent,low,pending,Enjoy him response nice we again energy drug everyone foot start I page rise sea yard catch by treatment.,orodriguez@gmail.com,James Johnson,staff,finance
1764484731181,urgent,medium,pending,Player cost certainly machine PM opportunity finish world follow drive I several also size candidate happen.,veronicawilliams@gmail.com,Jamie Smith,attendee,
1764484731181,urgent,low,pending,Forget into scene respond especially growth argue us myself music writer cost oil again support.,uray@gmail.com,Jonathan Mcfarland,attendee,
1764484731181,urgent,high,failure,Tv job class carry those top through west work have hotel finish worker leg high century live so stand customer education finish raise north admit official.,nicole98@gmail.com,Charles Harrison,attendee,
1764484731181,question,high,resolved,Politics idea read song remain war eye three race region Mrs entire suddenly what down range try.,stephenswanda@gmail.com,Lisa Sullivan,attendee,
1764484731181,other,low,pending,Various newspaper item trial home statement similar husband prevent Republican few moment cell decade institution task population I conference game recently.,kylehoward@hotmail.com,Diane Johnson,attendee,
1764484731181,other,high,resolved,Imagine will need compare group represent pay Republican song couple education stay board western investment more song sport any draw outside behind foreign own.,josephjones@yahoo.com,Amanda Gomez,attendee,
1764484731181,question,medium,failure,Huge describe similar here remain law rule population quality candidate change rate theory reduce learn subject practice election analysis either.,david40@yahoo.com,Nancy Young,attendee,
1764484731181,question,low,resolved,Really receive site turn oil before produce head nothing Mr itself hair maintain experience owner explain program argue official certain would.,marialopez@yahoo.com,Morgan Lewis,attendee,
